{"$defs":{"finding":{"additionalProperties":false,"properties":{"blocking":{"type":"boolean"},"code":{"maxLength":128,"pattern":"^[A-Z][A-Z0-9_]*$","type":"string"},"evidence_refs":{"items":{"$ref":"#/$defs/ref"},"maxItems":128,"type":"array","uniqueItems":true},"message":{"$ref":"#/$defs/text"},"repair_hint":{"$ref":"#/$defs/text"},"severity":{"enum":["info","warning","error"],"type":"string"}},"required":["code","severity","blocking","message","evidence_refs","repair_hint"],"type":"object"},"ref":{"maxLength":256,"minLength":1,"pattern":"^[A-Za-z0-9][A-Za-z0-9:._/@-]{0,255}$","type":"string"},"text":{"maxLength":16384,"minLength":1,"type":"string"}},"$id":"urn:yeisme:schema:background_asset.validation.v1","$schema":"https://json-schema.org/draft/2020-12/schema","additionalProperties":false,"properties":{"findings":{"items":{"$ref":"#/$defs/finding"},"maxItems":128,"type":"array"},"profile_id":{"const":"clean-background-plate-v1","type":"string"},"ready":{"type":"boolean"},"schema_version":{"const":"background_asset.validation.v1","type":"string"}},"required":["schema_version","profile_id","ready","findings"],"title":"AI Drama Background Asset Validation v1","type":"object"}