{"findings":[{"blocking":true,"code":"BACKGROUND_HUMAN_TRACE_FORBIDDEN","evidence_refs":["requested_elements"],"message":"背景资产不能包含雕像、人体模特或假人。","repair_hint":"移除真人比例雕像和一切拟人轮廓。","severity":"error"}],"profile_id":"clean-background-plate-v1","ready":false,"schema_version":"background_asset.validation.v1"}